{
  "schema_version": "1.0",
  "character_id": "synthetic-demo",
  "display_name": "Atlas Expert — Offline Demo",
  "renderer": "placeholder",
  "asset_ref": "embedded:css-svg-shape",
  "rights_status": "synthetic",
  "approval_state": "approved",
  "rights_owner": "AtlasHub reference demo",
  "locale": "pt-PT",
  "supported_states": [
    "idle",
    "listening",
    "thinking",
    "speaking",
    "paused",
    "error"
  ],
  "notes": "Simple CSS-drawn synthetic shape. NOT Helena, NOT a licensed 3D model."
}
